"Number", "Post ID", "Product ID", "Affiliate", "Product Title", "Brand", "Image URL", "Description", "Price", "RRP", "Link", "Status"
"1064 of 5914 (17.99%)", "11022", "3539_3257904143", "awin", "Annina Vogel Bespoke Diamond and Pearl Arrow Necklace - for Women", "Selfridges", "http://images.productserve.com/preview/9/3539/43/41/3257904143.jpg", "A gesture of love in Victorian jewellery, Cupid’s arrow represents a romantic declaration of one’s dedication and trust to another. Beautifully reimagined by Annina Vogel, this bespoke antique gold necklace features rose cut diamonds and pearls for the perfect year round gift.Annina Vogel necklace9ct gold guard chain, rose cut diamonds and pearlsLobster clasp fastening, antique pendantChain length 20”Made in the UK. Bespoke diamond and pearl arrow necklace", "8500.00", "0.00", "http://www.awin1.com/pclick.php?p=3257904143&a=99908&m=3539", "Updated"
"1065 of 5914 (18.01%)", "11020", "36580_24826", "linkshare", "Bloom Ring - Rose Gold", "Boticca.com Limited", "http://images.boticca-media.com/jewelry/rings/michellekiranaoh/gold_blue_brights_gold_color_lilac_metallic_gray_navy_blue_neutral_pastels_purple_red_sapphire/bloom-ring-rose-gold_1376343757_1.jpg?q=75&o=qn53I7KuIafjSTrZfwdPDq3kPq0j&V=Fc47", "Inspired by the early buds of Spring blossoms this ring signifies an eternity of new beginnings This 9ct Rose Gold ring features a 0 5ct brilliant cut lilac blue Sapphire set upside down to display hundreds of tiny facets The ring has been given a polished finish and is comfortable for day to day wear Sapphires are very tough second only to Diamonds and so prove to be popular gemstones for wedding jewellery We can also make this ring with Diamonds or any other stone you want simply send us a mes", "675.00", "675.00", "http://click.linksynergy.com/link?id=RIYrAqooNEU&offerid=215595.24826&type=15&murl=http%3A%2F%2Fboticca.com%2Fmichellekiranaoh%2Fbloom-ring-rose-gold%2F24826%2F%3Fchannel_code%3D1299%26product_code%3D88391402", "Updated"
"1066 of 5914 (18.03%)", "11019", "75939", "linkshare", "'love Grows' Gold Plated Heart Necklace", "", "", "", "", "", "", "Not Found"
"1067 of 5914 (18.04%)", "11018", "36580_24824", "linkshare", "Anemone Half Eternity Ring", "Boticca.com Limited", "http://images.boticca-media.com/jewelry/rings/michellekiranaoh/gold_beige_brights_champagne_gold_color_metallic_gray_neutral_pastels_white_yellow_diamond_sapphire/anemone-half-eternity-ring_1376341848_1.jpg?q=75&o=aQlStNQ6iw7p20UY10L3vlSLxsAj&V=HNTN", "Inspired by the wonderful silhouettes of Anemones growing from the ocean floor This 9ct Gold half eternity ring features 8 brilliant cut White Sapphires set organically into a beautifully textured ring band The granules around the ring have been given a rounded and polished finish they are comfortable for day to day wear These rings are also stackable please see photos for styling reference Sapphires are very tough second only to Diamonds and so prove to be popular gemstones for wedding jeweller", "865.00", "865.00", "http://click.linksynergy.com/link?id=RIYrAqooNEU&offerid=215595.24824&type=15&murl=http%3A%2F%2Fboticca.com%2Fmichellekiranaoh%2Fanemone-half-eternity-ring%2F24824%2F%3Fchannel_code%3D1299%26product_code%3D88395515", "Updated"
"1068 of 5914 (18.06%)", "11017", "21789", "linkshare", "Amethyst Prismic Slice Ring", "", "", "", "", "", "", "Not Found"
"1069 of 5914 (18.08%)", "11016", "21792", "linkshare", "Amazonite Prismic Slice Ring", "", "", "", "", "", "", "Not Found"
"1070 of 5914 (18.09%)", "11015", "57506", "linkshare", "18ct Gold Vermeil Ring Necklace With Stones", "", "", "", "", "", "", "Not Found"
"1071 of 5914 (18.11%)", "11005", "110034101944230128204522354065", "linkshare", "Classic V-neck Dress", "", "", "", "", "", "", "Not Found"
"1072 of 5914 (18.13%)", "11004", "35118_110058111971341537214452415493", "linkshare", "Beatrice Embroidered Silk Dress", "Browns Fashion", "http://static.browns.kaeto.net/ProductImages/670x830/010V09800002_1.jpg", "The intricate detailing on Alice Archer\'s shimmering silver silk Beatrice dress is inspired by artist Claude-Marie Dubufe\'s \'The Surprise\' and is achieved using a combination of embroidery and print. The three dimensional effect has been created by printing directly onto a ceramic thread that contains a small amount of porcelain, resulting in a unique trompe l\'oeil design. It\'s cut to an elegant and simple silhouette, allowing the classical imagery to take centre-stage.", "2000.00", "2000.00", "http://click.linksynergy.com/link?id=RIYrAqooNEU&offerid=163081.110058111971341537214452415493&type=15&murl=http%3A%2F%2Fwww.brownsfashion.com%2Fproduct%2F010V09800002%2F256%2Fbeatrice-embroidered-silk-dress", "Updated"
"1073 of 5914 (18.14%)", "11003", "35118_110017554334097416148536241338", "linkshare", "Babette Embroidered Silk Dress", "Browns Fashion", "http://static.browns.kaeto.net/ProductImages/670x830/010V09800003_1.jpg", "Alice Archer uses a unique blend of embroidery and print to craft the floral detailing on her limited-edition pieces for Browns. This dress is cut from satin to a fitted silhouette and is an elegant piece of demi-couture that will make a statement at your next event. This dress is available in bespoke colour variations of fuchsia, carmine red or black. To enquire about having one made, please contact customercare@brownsfashion.com.", "2000.00", "2000.00", "http://click.linksynergy.com/link?id=RIYrAqooNEU&offerid=163081.110017554334097416148536241338&type=15&murl=http%3A%2F%2Fwww.brownsfashion.com%2Fproduct%2F010V09800003%2F108%2Fbabette-embroidered-silk-dress", "Updated"
"1074 of 5914 (18.16%)", "11002", "35118_110022015342012739346303880919", "linkshare", "Abstract Flower Print Dress", "Browns Fashion", "http://static.browns.kaeto.net/ProductImages/670x830/017G09800003_1.jpg", "With its flax-blend fabric and abstract flower print this dress from Marni is the perfect example of this season\'s bohemian mood. Wear yours with statement heels for an impactful look.", "910.00", "910.00", "http://click.linksynergy.com/link?id=RIYrAqooNEU&offerid=163081.110022015342012739346303880919&type=15&murl=http%3A%2F%2Fwww.brownsfashion.com%2Fproduct%2F017G09800003%2F113%2Fabstract-flower-print-dress", "Updated"
"1075 of 5914 (18.18%)", "10998", "39261_1880", "linkshare", "Lisa Tan Millinery - Daniela", "Lovehats.com", "http://d13hl1umzs80h7.cloudfront.net/uploads/images/products/image_main/daniela.jpg", "Striking Hat with Silk Crown and Quill Trim Key features: * A modern take on a classic tulip-shaped hat with detailed check sinamay brim and solid printed silk crown. Two sculpted quills with burnt peacock spray ends are shaped across the front of the hat to the side.", "465.00", "465.00", "http://click.linksynergy.com/link?id=RIYrAqooNEU&offerid=326126.1880&type=15&murl=http%3A%2F%2Fen-gb.lovehats.com%2Fp%2Flisa-tan-millinery-daniela", "Updated"
"1076 of 5914 (18.19%)", "10997", "39261_1908", "linkshare", "Laura Cathcart - Peony", "Lovehats.com", "http://d13hl1umzs80h7.cloudfront.net/uploads/images/products/image_main/1peony.jpg", "Beautiful Widebrim Hat with Exotic Trim Key features: * Fabulously feminine hat in striking ice blue with ostrich feather pom-pom trim and oversized bow. Worn on a wire headband.", "535.00", "535.00", "http://click.linksynergy.com/link?id=RIYrAqooNEU&offerid=326126.1908&type=15&murl=http%3A%2F%2Fen-gb.lovehats.com%2Fp%2Flaura-cathcart-peony", "Updated"
"1077 of 5914 (18.21%)", "10996", "39261_1913", "linkshare", "Laura Cathcart - Julia", "Lovehats.com", "http://d13hl1umzs80h7.cloudfront.net/uploads/images/products/image_main/julia.jpg", "Glamorous Hat with Striking Feather Detail Key features: * Pretty pink button base with charming peach silk bow and striking brooch detail at the base of the captivating pheasant feather trim.", "280.00", "280.00", "http://click.linksynergy.com/link?id=RIYrAqooNEU&offerid=326126.1913&type=15&murl=http%3A%2F%2Fen-gb.lovehats.com%2Fp%2Flaura-cathcart-julia", "Updated"
"1078 of 5914 (18.23%)", "10995", "39261_1910", "linkshare", "Laura Cathcart - Hyacinth", "Lovehats.com", "http://d13hl1umzs80h7.cloudfront.net/uploads/images/products/image_main/4hyacinth.jpg", "Chic Widebrim Hat with Silk Trim Key features: * Delightful and alluring this high crowned hat in French Navy is trimmed with beautiful silk ruffle twirls and arrow head feathers in tones of blue.", "695.00", "695.00", "http://click.linksynergy.com/link?id=RIYrAqooNEU&offerid=326126.1910&type=15&murl=http%3A%2F%2Fen-gb.lovehats.com%2Fp%2Flaura-cathcart-hyacinth-1", "Updated"
"1079 of 5914 (18.24%)", "10994", "39261_1912", "linkshare", "Laura Cathcart - Dorothy", "Lovehats.com", "http://d13hl1umzs80h7.cloudfront.net/uploads/images/products/image_main/dorothy.jpg", "Elegant Beret Style Cocktail Hat with Veiling and Bow Key features: * Beautifully charming this smart button hat in dark navy is trimmed with a playful oversized bow and attractive veiling in tones of blue.", "380.00", "380.00", "http://click.linksynergy.com/link?id=RIYrAqooNEU&offerid=326126.1912&type=15&murl=http%3A%2F%2Fen-gb.lovehats.com%2Fp%2Flaura-cathcart-dorothy", "Updated"
"1080 of 5914 (18.26%)", "10993", "39261_1914", "linkshare", "Laura Cathcart - Cressida", "Lovehats.com", "http://d13hl1umzs80h7.cloudfront.net/uploads/images/products/image_main/cressida.jpg", "Elegant Silk Headpiece with Charming Detail Key features: * Beautiful blue silk button headpiece with delightful brooch rosette detail and sculptural feather trim.", "460.00", "460.00", "http://click.linksynergy.com/link?id=RIYrAqooNEU&offerid=326126.1914&type=15&murl=http%3A%2F%2Fen-gb.lovehats.com%2Fp%2Flaura-cathcart-cressida", "Updated"
"1081 of 5914 (18.28%)", "10992", "39261_1911", "linkshare", "Laura Cathcart - Anemone", "Lovehats.com", "http://d13hl1umzs80h7.cloudfront.net/uploads/images/products/image_main/2anemone.jpg", "Striking Button Headpiece with Silk Flower Trim Key features: * Charming button headpiece in beautiful royal blue adorned with lavish silk flowers in tones of blue. This piece is worn on elastic.", "240.00", "240.00", "http://click.linksynergy.com/link?id=RIYrAqooNEU&offerid=326126.1911&type=15&murl=http%3A%2F%2Fen-gb.lovehats.com%2Fp%2Flaura-cathcart-anemone", "Updated"
"1082 of 5914 (18.30%)", "10991", "39261_1528", "linkshare", "Keely Hunter Millinery - Double Disk Percher", "Lovehats.com", "http://d13hl1umzs80h7.cloudfront.net/uploads/images/products/image_main/double-disk-percher.jpg", "Contemporary Disks On Felt Base Key features: * This futuristic headpiece offers a contemporary twist to the pillbox percher. Wear with textured leathers and sparkly accessories to make an entrance.", "260.00", "260.00", "http://click.linksynergy.com/link?id=RIYrAqooNEU&offerid=326126.1528&type=15&murl=http%3A%2F%2Fen-gb.lovehats.com%2Fp%2Fkeely-hunter-millinery-double-disk-percher", "Updated"
"1083 of 5914 (18.31%)", "10990", "39261_1426", "linkshare", "Justine Bradley-hill - Thiea", "Lovehats.com", "http://d13hl1umzs80h7.cloudfront.net/uploads/images/products/image_main/thiea.jpg", "Beautiful Metallic Sinamay Headpiece with Leather, Crystals and Quill Trim Key features: * Dramatic and striking, this beautiful handblocked hat has more than a little oriental glamour. Work the romance with a sultry eye and sparkling accessories.", "340.00", "340.00", "http://click.linksynergy.com/link?id=RIYrAqooNEU&offerid=326126.1426&type=15&murl=http%3A%2F%2Fen-gb.lovehats.com%2Fp%2Fjustine-bradley-hill-thiea", "Updated"
"1084 of 5914 (18.33%)", "10989", "39261_1428", "linkshare", "Justine Bradley-hill - Selene Bow", "Lovehats.com", "http://d13hl1umzs80h7.cloudfront.net/uploads/images/products/image_main/selene-bow.jpg", "Stunning Black Silk Button and Bow Headpiece Key features: * Understated romance in classic black topped off with an oversized bow. Keep it sweet with an elegant LBD or contrast with trend-led leather.", "220.00", "220.00", "http://click.linksynergy.com/link?id=RIYrAqooNEU&offerid=326126.1428&type=15&murl=http%3A%2F%2Fen-gb.lovehats.com%2Fp%2Fjustine-bradley-hill-selene-bow", "Updated"
"1085 of 5914 (18.35%)", "10988", "39261_1347", "linkshare", "Justine Bradley-hill - Rose", "Lovehats.com", "http://d13hl1umzs80h7.cloudfront.net/uploads/images/products/image_main/rose.jpg", "Striking Metallic White Sweeping Brim with Crystal Coverd Silk Flowers and Crin Trim Key features: * Dramatic and striking, this sparkling handblocked hat has more than a little oriental glamour. Work the romance with a sultry eye and bold accessories.", "224.00", "224.00", "http://click.linksynergy.com/link?id=RIYrAqooNEU&offerid=326126.1347&type=15&murl=http%3A%2F%2Fen-gb.lovehats.com%2Fp%2Fjustine-bradley-hill-rose", "Updated"
"1086 of 5914 (18.36%)", "10987", "39261_1941", "linkshare", "Justine Bradley-hill - Rosa", "Lovehats.com", "http://d13hl1umzs80h7.cloudfront.net/uploads/images/products/image_main/4rosa.jpg", "Striking French Navy Hat with Silk Rose and Veiling Key features: * Contemporary silk headpiece in French Navy with striking oversized silk rose bloom and navy birdcage veiling with crystals adding a touch of mystery.", "330.00", "330.00", "http://click.linksynergy.com/link?id=RIYrAqooNEU&offerid=326126.1941&type=15&murl=http%3A%2F%2Fen-gb.lovehats.com%2Fp%2Fjustine-bradley-hill-rosa", "Updated"
"1087 of 5914 (18.38%)", "10986", "39261_1424", "linkshare", "Justine Bradley-hill - Rhea", "Lovehats.com", "http://d13hl1umzs80h7.cloudfront.net/uploads/images/products/image_main/rhea.jpg", "Beautiful Navy Button Shaped Pillbox with Jade Leather Flower Detail and Felt Ribbons Key features: * Stylish sophistication, this headpiece is the ultimate way to introduce on trend hues into your winter wardrobe.", "265.00", "265.00", "http://click.linksynergy.com/link?id=RIYrAqooNEU&offerid=326126.1424&type=15&murl=http%3A%2F%2Fen-gb.lovehats.com%2Fp%2Fjustine-bradley-hill-rhea", "Updated"
"1088 of 5914 (18.40%)", "10985", "39261_1940", "linkshare", "Justine Bradley-hill - Paper Blossom", "Lovehats.com", "http://d13hl1umzs80h7.cloudfront.net/uploads/images/products/image_main/paper-blossom.jpg", "Stunning White Hat with Contemporary Trim Key features: * Dramatic and striking, this beautiful hat has powerful oriental glamour with ornate leather flower stem embellished with black crystal centres and delicate feather spray", "340.00", "340.00", "http://click.linksynergy.com/link?id=RIYrAqooNEU&offerid=326126.1940&type=15&murl=http%3A%2F%2Fen-gb.lovehats.com%2Fp%2Fjustine-bradley-hill-paper-blossom", "Updated"
"1089 of 5914 (18.41%)", "10984", "39261_1472", "linkshare", "Justine Bradley-hill - Isis", "Lovehats.com", "http://d13hl1umzs80h7.cloudfront.net/uploads/images/products/image_main/isis.jpg", "Beautiful Navy Sinamay Disc with Leather FLower Trim and Silver Thread Key features: * This stunning 1930\'s influenced disc hat features the most decadent trim made up of a pearl white leather flower with spot veiling and quills. Work with summer metallics and leather for an extra edge.", "340.00", "340.00", "http://click.linksynergy.com/link?id=RIYrAqooNEU&offerid=326126.1472&type=15&murl=http%3A%2F%2Fen-gb.lovehats.com%2Fp%2Fjustine-bradley-hill-isis", "Updated"
"1090 of 5914 (18.43%)", "10983", "24423_1474", "linkshare", "Pink & Amethyst Drop Earrings", "Forzieri.com (uk)", "http://dynamic.forzieri.com/is/image/Forzieri/354x454/az35406-010-1x.jpg", "AZ Collection Pink & Amethyst Drop Earrings", "129.00", "129.00", "http://click.linksynergy.com/link?id=RIYrAqooNEU&offerid=208531.1474&type=15&murl=http%3A%2F%2Fwww.uk.forzieri.com%2Fearrings%2Faz-collection%2Faz35406-010-00%2F%3Fgfx%3D1%26type%3Dprodfeed%26camp%3Dlinkshare_uk%26source%3Dlinkshare", "Updated"
"1091 of 5914 (18.45%)", "10982", "39261_1427", "linkshare", "Justine Bradley-hill - Helios Bow", "Lovehats.com", "http://d13hl1umzs80h7.cloudfront.net/uploads/images/products/image_main/helios-bow.jpg", "Luxurious Gold Button Pillbox with Striking Bow Detail Key features: * Lavishly decadent, this beautiful headpiece will add glamour and sparkle to an array of items from the winter wardrobe.", "220.00", "220.00", "http://click.linksynergy.com/link?id=RIYrAqooNEU&offerid=326126.1427&type=15&murl=http%3A%2F%2Fen-gb.lovehats.com%2Fp%2Fjustine-bradley-hill-helios-bow", "Updated"
"1092 of 5914 (18.46%)", "10981", "24423_1471", "linkshare", "Amber Tear-drop Clip-on Earrings", "Forzieri.com (uk)", "http://dynamic.forzieri.com/is/image/Forzieri/354x454/az35406-005-1x.jpg", "AZ Collection Amber Tear-Drop Clip-On Earrings", "93.00", "93.00", "http://click.linksynergy.com/link?id=RIYrAqooNEU&offerid=208531.1471&type=15&murl=http%3A%2F%2Fwww.uk.forzieri.com%2Fearrings%2Faz-collection%2Faz35406-005-00%2F%3Fgfx%3D1%26type%3Dprodfeed%26camp%3Dlinkshare_uk%26source%3Dlinkshare", "Updated"
"1093 of 5914 (18.48%)", "10980", "24423_1344", "linkshare", "Lemon Front Tie Calf Leather Slingback Shoes", "Forzieri.com (uk)", "http://dynamic.forzieri.com/is/image/Forzieri/320x320/prdm_at43115-002-2.jpg", "Amaltea Lemon Front Tie Calf Leather Slingback Shoes", "241.00", "241.00", "http://click.linksynergy.com/link?id=RIYrAqooNEU&offerid=208531.1344&type=15&murl=http%3A%2F%2Fwww.uk.forzieri.com%2Fshoes%2Famaltea%2Fat43115-002-00%2F%3Fgfx%3D1%26type%3Dprodfeed%26camp%3Dlinkshare_uk%26source%3Dlinkshare", "Updated"
"1094 of 5914 (18.50%)", "10979", "39261_1854", "linkshare", "John Boyd Millinery - Silk Fringe Pom Pom", "Lovehats.com", "http://d13hl1umzs80h7.cloudfront.net/uploads/images/products/image_main/silk-fringe-pom-pom.jpg", "French Navy Cocktail Hat with Pom Pom Trim Key features: * This witty style is a contemporary take on a classic cocktail hat combining shot silk folds and silk fringe pom-poms with the simple sinamay base.", "370.00", "370.00", "http://click.linksynergy.com/link?id=RIYrAqooNEU&offerid=326126.1854&type=15&murl=http%3A%2F%2Fen-gb.lovehats.com%2Fp%2Fjohn-boyd-millinery-silk-fringe-pom-pom", "Updated"
"1095 of 5914 (18.52%)", "10978", "39261_1856", "linkshare", "John Boyd Millinery - Bow Pillbox", "Lovehats.com", "http://d13hl1umzs80h7.cloudfront.net/uploads/images/products/image_main/bow-pillbox.jpg", "Simple Textured Pillbox with Crin Bow Key features: * Alluring black embroidered pillbox with crin overlay and quirky bow detail on the reverse.", "498.00", "498.00", "http://click.linksynergy.com/link?id=RIYrAqooNEU&offerid=326126.1856&type=15&murl=http%3A%2F%2Fen-gb.lovehats.com%2Fp%2Fjohn-boyd-millinery-bow-pillbox", "Updated"
"1096 of 5914 (18.53%)", "10974", "39261_1249", "linkshare", "Jill Courtemanche Millinery - Katia", "Lovehats.com", "http://d13hl1umzs80h7.cloudfront.net/uploads/images/products/image_main/katia.jpg", "Striking Silver Fox Fur Hat Key features: * Nothing keeps the chill out like fur, and this silver fox fur hat is surely the most glamorous way to work the trend. In striking silver grey it is the perfect accent piece to the ornate baroque looks around this winter.", "390.00", "390.00", "http://click.linksynergy.com/link?id=RIYrAqooNEU&offerid=326126.1249&type=15&murl=http%3A%2F%2Fen-gb.lovehats.com%2Fp%2Fjill-courtemanche-millinery-katia", "Updated"
"1097 of 5914 (18.55%)", "10973", "36731_1217", "linkshare", "J Brand Aidan Slouchy Boy Jean", "Question-air", "http://www.question-air.com/media/catalog/product/j/-/j-brand-aidan-slouchy-boy-jean-lwjbdea30002ftl-1.43.jpg", "J Brand Aidan Slouchy Boy Jean", "265.00", "265.00", "http://click.linksynergy.com/link?id=RIYrAqooNEU&offerid=223253.1217&type=15&murl=http%3A%2F%2Fwww.question-air.com%2Fj-brand-aidan-slouchy-boy-jean.html%3Ffee%3D17%26fep%3D3130", "Updated"
"1098 of 5914 (18.57%)", "10972", "39261_1765", "linkshare", "Anthony Peto - Beverly - 57", "Lovehats.com", "http://d13hl1umzs80h7.cloudfront.net/uploads/images/products/image_main/beverly.jpg", "Classic Black Wide Brim Winter Hat Key features: * This chic easy-to-wear style in black fur felt is the perfect winter accessory. Team with Cashmere and colour for added glamour.", "125.00", "125.00", "http://click.linksynergy.com/link?id=RIYrAqooNEU&offerid=326126.1765&type=15&murl=http%3A%2F%2Fen-gb.lovehats.com%2Fp%2Fanthony-peto-beverly", "Updated"
"1099 of 5914 (18.58%)", "10971", "37195_2452", "linkshare", "Your July Skincare Essentials Regime - N", "Liz Earle Beauty Co Ltd", "http://uk.lizearle.com/media/catalog/product/image-repository/ESSJUL14NC/ESSJUL14NC-0-large.jpg", "Order your cleanse, tone and moisturise trio for &euro;56 before Wednesday 30th July, and we\'ll indulge you with a complimentary Botanical Shine Shampoo 200ml and a Botanical Shine Conditioner for normal hair 50ml, worth &euro;16.50. Specially formulated with naturally active ingredients, this high-performance haircare duo will leave your locks looking enviably luminous. Plus, you\'ll enjoy free ROI delivery on your entire order too.", "45.00", "45.00", "http://click.linksynergy.com/link?id=RIYrAqooNEU&offerid=366675.2452&type=15&murl=http%3A%2F%2Fuk.lizearle.com%2Fyour-july-2014-skincare-essentials.html", "Updated"
"1100 of 5914 (18.60%)", "10970", "39261_854", "linkshare", "Jill Courtemanche Millinery - Veuve Noir", "Lovehats.com", "http://d13hl1umzs80h7.cloudfront.net/uploads/images/products/image_main/veuve-noir.jpg", "Vintage Racello Straw Headpiece with Feather Flower, Velvet Leaves and Veiling Key features: * Chic vintage style cocktail hat that will perfectly accessorise a flirty summer dress, just add a sweep of bright lipstick.", "262.00", "262.00", "http://click.linksynergy.com/link?id=RIYrAqooNEU&offerid=326126.854&type=15&murl=http%3A%2F%2Fen-gb.lovehats.com%2Fp%2Fjill-courtemanche-millinery-veuve-noir", "Updated"
"1101 of 5914 (18.62%)", "10969", "39261_849", "linkshare", "Jill Courtemanche Millinery - Le Plus Fort", "Lovehats.com", "http://d13hl1umzs80h7.cloudfront.net/uploads/images/products/image_main/le-plus-fort.jpg", "Mini Pink Sinamay Top Hat with Ribbon Band, Feathers and Vintage Veiling Key features: * Supremely elegant and with more than a touch of wit, this mini top hat is perfect to add a touch of equestrian chic for just about any occasion.", "215.00", "215.00", "http://click.linksynergy.com/link?id=RIYrAqooNEU&offerid=326126.849&type=15&murl=http%3A%2F%2Fen-gb.lovehats.com%2Fp%2Fjill-courtemanche-millinery-le-plus-fort", "Updated"
"1102 of 5914 (18.63%)", "10968", "39261_1717", "linkshare", "Jill Courtemanche Millinery - Jolie Femme Grey", "Lovehats.com", "http://d13hl1umzs80h7.cloudfront.net/uploads/images/products/image_main/jolie-femme-grey.jpg", "Stylish White Summer Widebrim with Grey Silk Trim Key features: * Simple for the sunshine, this lightweight large brimmed sunhat will make a statement on the beach or guarantee classic elegance at the races or lunch party.", "270.00", "270.00", "http://click.linksynergy.com/link?id=RIYrAqooNEU&offerid=326126.1717&type=15&murl=http%3A%2F%2Fen-gb.lovehats.com%2Fp%2Fjill-courtemanche-millinery-jolie-femme-grey", "Updated"
"1103 of 5914 (18.65%)", "10967", "36731_1718", "linkshare", "Ella Moss Parajo Printed Tank", "Question-air", "http://www.question-air.com/media/catalog/product/e/l/ella-moss-parajo-printed-tank-lwemtps20005nig-1.43.jpg", "Ella Moss Parajo Printed Tank", "99.00", "99.00", "http://click.linksynergy.com/link?id=RIYrAqooNEU&offerid=223253.1718&type=15&murl=http%3A%2F%2Fwww.question-air.com%2Fella-moss-parajo-printed-tank.html%3Ffee%3D17%26fep%3D3992", "Updated"
"1104 of 5914 (18.67%)", "10966", "36598_1248", "linkshare", "John Smedley Wings Snow White Shawl", "John Smedley", "http://www.johnsmedley.com/media/catalog/product/w/i/wings_snow_white_main_1.jpg", "John Smedley Wings Snow White Shawl", "100.00", "100.00", "http://click.linksynergy.com/link?id=RIYrAqooNEU&offerid=219540.1248&type=15&murl=http%3A%2F%2Fwww.johnsmedley.com%2Fuk%2Fss15-wings-in-snow-white", "Updated"
"1105 of 5914 (18.68%)", "10965", "37567_551", "linkshare", "Madagascan Vanilla Flower Eau De Toilette", "The Body Shop Uk", "http://www.thebodyshop.co.uk/images/product/Med_Large/94777m_m_l.jpg", "Escape to Madagascar with vanilla flower. Inspired by a sunny day on the tropical island of Madagascar, this warm, sensual eau de toilette from our Scents of the World fragrance collection features a blend of floral and oriental accords.", "16.00", "16.00", "http://click.linksynergy.com/link?id=RIYrAqooNEU&offerid=259342.551&type=15&murl=http%3A%2F%2Fwww.thebodyshop.co.uk%2Ffragrance%2Fview-all-fragrance%2Fmadagascan-vanilla-flower-eau-de-toilette.aspx", "Updated"
"1106 of 5914 (18.70%)", "10964", "24423_475", "linkshare", "Carlo The Little Ghost- Set Of 4 Bottle Caps", "Forzieri.com (uk)", "http://dynamic.forzieri.com/is/image/Forzieri/320x320/prdm_al38377-046-2.jpg", "Alessi Carlo the little ghost- Set of 4 Bottle Caps", "13.00", "13.00", "http://click.linksynergy.com/link?id=RIYrAqooNEU&offerid=208531.475&type=15&murl=http%3A%2F%2Fwww.uk.forzieri.com%2Fkitchen-dining%2Falessi%2Fal38377-046-00%2F%3Fgfx%3D1%26type%3Dprodfeed%26camp%3Dlinkshare_uk%26source%3Dlinkshare", "Updated"
"1107 of 5914 (18.72%)", "10963", "37567_404", "linkshare", "Hemp Body Mitt", "The Body Shop Uk", "http://www.thebodyshop.co.uk/images/product/Med_Large/18795m_m_l.jpg", "Real smoothies can\'t get enough of this invigorating mitt. Also helps stimulate circulation.", "7.00", "7.00", "http://click.linksynergy.com/link?id=RIYrAqooNEU&offerid=259342.404&type=15&murl=http%3A%2F%2Fwww.thebodyshop.co.uk%2Fbath-body-care%2Fview-all-bath-body%2Fhemp-body-mitt.aspx", "Updated"
