"Number", "Post ID", "Product ID", "Affiliate", "Product Title", "Brand", "Image URL", "Description", "Price", "RRP", "Link", "Status"
"407 of 5914 (6.88%)", "11783", "2246_3245371577", "awin", "Gina Snap Front Jacket Multi - Yellow", "L.K. Bennett", "http://images.productserve.com/preview/6/2246/77/15/3245371577.jpg", "Glamorous Gina is the go-to cover-up this season. This classic jacket  is reimagined with an ever chic jacquard print, making it perfect for summer weddings and garden parties. Keep your accessories simple to let Gina take centre stage.", "295.00", "295.00", "http://www.awin1.com/pclick.php?p=3245371577&a=99908&m=2246", "Updated"
"408 of 5914 (6.90%)", "11780", "2246_3206846045", "awin", "Wardour Lace Overlay Skirt Pink - Jelly Bean", "L.K. Bennett", "http://images.productserve.com/preview/6/2246/45/60/3206846045.jpg", "In summer-ready pink over a steel grey base, Wardour exudes elegant style. This skirt dress flatters the silhouette with a lace overlay falling to the knee. Endlessly versatile, Wardour can be teamed with silk blouse or camisole and pointed pumps for a feminine finish.", "175.00", "175.00", "http://www.awin1.com/pclick.php?p=3206846045&a=99908&m=2246", "Updated"
"409 of 5914 (6.92%)", "11779", "2246_3197996595", "awin", "Wardour Lace Overlay Skirt Blue - Sloane Blue", "L.K. Bennett", "http://images.productserve.com/preview/6/2246/95/65/3197996595.jpg", "In summer-ready pink over a steel grey base, Wardour exudes elegant style. This skirt dress flatters the silhouette with a lace overlay falling to the knee. Endlessly versatile, Wardour can be teamed with silk blouse or camisole and pointed pumps for a feminine finish.", "175.00", "175.00", "http://www.awin1.com/pclick.php?p=3197996595&a=99908&m=2246", "Updated"
"410 of 5914 (6.93%)", "11778", "3123123377", "awin", "Santana Colour Block Shift Dress Black - White", "", "", "", "", "", "", "Not Found"
"411 of 5914 (6.95%)", "11777", "2246_3174710481", "awin", "Safari Panel Dress Printed - Black Cream", "L.K. Bennett", "http://images.productserve.com/preview/6/2246/81/04/3174710481.jpg", "Tailored elegance is embodied in Safari, a striking and versatile piece. With sixties inspired high square neck line and nipped in waist to shape the silhouette, the monochrome cotton blend contrasts with the solid black wide straps. The defining detail is the low back, outlined by the shoulder straps into a chic point - alluring and flattering. This dress will see you from desk to cocktail party and beyond - a timeless piece.", "125.00", "295.00", "http://www.awin1.com/pclick.php?p=3174710481&a=99908&m=2246", "Updated"
"412 of 5914 (6.97%)", "11776", "2246_3174710513", "awin", "Mariana Pleat Dress Blue - Regal", "L.K. Bennett", "http://images.productserve.com/preview/6/2246/13/05/3174710513.jpg", "Marina is the perfect fit. This gorgeously proportioned dress has been cut to sculpt the silhouette, thanks to the flattering pleat detailing and delicately capped sleeves. Marina\'s rich navy hue equips her elegantly for a number of occasions - add in classic courts and an envelope clutch to take you from desk to dinner, or try metallic accompaniments for dressier events.", "150.00", "250.00", "http://www.awin1.com/pclick.php?p=3174710513&a=99908&m=2246", "Updated"
"413 of 5914 (6.98%)", "11775", "2246_3216224279", "awin", "Larinda Tuxedo Jacket Cream - Champagne", "L.K. Bennett", "http://images.productserve.com/preview/6/2246/79/42/3216224279.jpg", "A fresh take on the classic tux, our Larinda is the perfect cover-up day or night. In soft champagne, this jacket features a single button design and contrast collar detailing. The jacket works just as well in the office as it does draped over a delicate evening dress.", "325.00", "325.00", "http://www.awin1.com/pclick.php?p=3216224279&a=99908&m=2246", "Updated"
"414 of 5914 (7.00%)", "11774", "2246_3228486059", "awin", "Hannah Printed Shift Dress Printed - Yellow", "L.K. Bennett", "http://images.productserve.com/preview/6/2246/59/60/3228486059.jpg", "Embrace florals this season with Hannah. This classic sleeveless shift dress features an effortlessly feminine sweetpea print and cut away detailing around the neck. Keep accessories simple with pointed pumps and a clutch for a look that will take you from summer wedding to garden party.", "195.00", "195.00", "http://www.awin1.com/pclick.php?p=3228486059&a=99908&m=2246", "Updated"
"415 of 5914 (7.02%)", "11773", "2246_3228486055", "awin", "Gardo Jacquard Dress Printed - Multi", "L.K. Bennett", "http://images.productserve.com/preview/6/2246/55/60/3228486055.jpg", "or a stylish summer dress, look no further than Gardo. This beautiful silk-mix dress aims to flatters the silhouette with a skater shape that falls below the knee and a chic abstract floral design. Tie the look together with pointed pumps and co-ordinating clutch for garden parties and summer weddings.", "350.00", "350.00", "http://www.awin1.com/pclick.php?p=3228486055&a=99908&m=2246", "Updated"
"416 of 5914 (7.03%)", "11772", "2246_3235622641", "awin", "Gardo Cropped Jacquard Jacket Printed - Multi", "L.K. Bennett", "http://images.productserve.com/preview/6/2246/41/26/3235622641.jpg", "For a stylish summer cover-up, look no further than Gardo. This beautiful silk-mix jacket features an abstract floral design, while the collarless design and bracelet length sleeves perfectly complement the cropped length. Throw over the matching dress or team with a colour pop blouse and tailored trousers.", "295.00", "295.00", "http://www.awin1.com/pclick.php?p=3235622641&a=99908&m=2246", "Updated"
"417 of 5914 (7.05%)", "11762", "2805_3207924799", "awin", "Sezel Skirt Petite", "Coast", "http://images.productserve.com/preview/5/2805/99/47/3207924799.jpg", "Add this statement piece to brighten up your wardrobe. The Sezel Skirt Petite features a modern A-line silhouette and a cinched in waist which flatters the figure beautifully. This seasons must have striped skirt features a modern twist with the beautifully fresh floral print. This skirt closes with a back zip and measures 18.5 inches/47cm from waist to hem.", "55.00", "0.00", "http://www.awin1.com/pclick.php?p=3207924799&a=99908&m=2805", "Updated"
"418 of 5914 (7.07%)", "11761", "2805_3225273179", "awin", "Rita Skirt Petite", "Coast", "http://images.productserve.com/preview/5/2805/79/31/3225273179.jpg", "The Rita Skirt is designed with metallic floral embroidery and a lustrous coated finish. This catwalk inspired piece oozes vintage glamour thanks to the voluminous pleating. For added fullness this skirt has been expertly crafted with tulle under lining that is exaggerated by the small cinched in waist. This skirt closes with a concealed back zip  features side pockets and is 24 inches/ 61cm in length from waist to hem. This PETITE style is designed to fit women of 5ft 3 (160cm) and under. Model wears: UK 10.", "129.00", "0.00", "http://www.awin1.com/pclick.php?p=3225273179&a=99908&m=2805", "Updated"
"419 of 5914 (7.08%)", "11760", "2805_3110016453", "awin", "Michegan Maxi Dress Petite.", "Coast", "http://images.productserve.com/preview/5/2805/53/64/3110016453.jpg", "A gorgeous luxurious floor-sweeping gown that is sure to put you in the limelight. The Petite Michigan Maxi Dress has a stunning sweetheart neckline and boning in the bodice for a sleek and softly structured appeal. The dress features lustrous gathered satin detail at the waist which beautifully flatters your curves. The waterfall drape detail on the skirt adds just the right amount of romance to this head turning gown. This PETITE style is designed to fit women of 5ft 3 (160cm) and under. Model wears UK size: 10.", "95.00", "0.00", "http://www.awin1.com/pclick.php?p=3110016453&a=99908&m=2805", "Updated"
"420 of 5914 (7.10%)", "11759", "2805_3255932603", "awin", "Meslita Skirt Petite", "Coast", "http://images.productserve.com/preview/5/2805/03/26/3255932603.jpg", "This glamorously designed catwalk inspired skirt is your ideal choice for this seasons events. Crafted from our exclusively made Duchess Satin  the Meslita skirt Petite features exaggerated fullness given by the tulle underlay and a waistband that cinches you in at the waist. Fully lined for ultimate comfort the skirt is closed with a concealed back zip. This PETITE style is designed to fit women of 5ft 3 (160cm) and under. Model wears: UK Size 10.", "129.00", "0.00", "http://www.awin1.com/pclick.php?p=3255932603&a=99908&m=2805", "Updated"
"421 of 5914 (7.12%)", "11758", "2805_3202544997", "awin", "Kandiz Jumpsuit Petite", "Coast", "http://images.productserve.com/preview/5/2805/97/49/3202544997.jpg", "Tapered through the leg for an expertly tailored look the Kandiz Jumpsuit Petite has a sleek look with an effortless edge. Constructed with an internal boned bodice and a wrap over draped waistband  this bandeau style features a front notch detail. This jumpsuit closes with a concealed back zip. Slip your hands in the side pockets for added function. Maximize the look with towering heels. This PETITE style is designed to fit women of 5ft 3 (160cm) and under. Model wears UK size: 10.", "115.00", "0.00", "http://www.awin1.com/pclick.php?p=3202544997&a=99908&m=2805", "Updated"
"422 of 5914 (7.14%)", "11752", "36580_10184", "linkshare", "The Celeste Woven Ribbon Necklace In Coral/cream", "Boticca.com Limited", "http://images.boticca-media.com/jewelry/necklaces/jenniferloiselle/other_beige/the-celeste-woven-ribbon-necklace-in-coral-cream_1323367662_5.jpg?q=75&o=nukwI59Aka@PSFu6eAnPOCMOAGkj&V=a9kI", "The perfect addition to any wardrove the Celeste necklace will add a pop of colour to your outfit The necklace is inspired by the work of artist Louise Bourgeois and features oversized acrylic beads mixed with woven ribbon in coral ivory charcoal grey and black It s finished off with a sterling silver lobster clasp and embossed logo stamp Each piece is carefully hand crafted by myself and will come beautifully packaged", "80.00", "80.00", "http://click.linksynergy.com/link?id=RIYrAqooNEU&offerid=215595.10184&type=15&murl=http%3A%2F%2Fboticca.com%2Fjenniferloiselle%2Fthe-celeste-woven-ribbon-necklace-in-coral-cream%2F10184%2F%3Fchannel_code%3D1299%26product_code%3D88393825", "Updated"
"423 of 5914 (7.15%)", "11751", "10914", "linkshare", "Jigsaw Sleeveless Lace Dress Garnet", "", "", "", "", "", "", "Not Found"
"424 of 5914 (7.17%)", "11750", "35725_1007865", "linkshare", "Julianna Dress", "Matchesfashion.com - Uk", "http://assetsprx.matchesfashion.com/img/product/500/1007865_1_zoom.jpg", "DVF reworks her iconic wrap dress in occasion-ready floral lace for the new season. In a vivid green hue it has delicate sheer sleeves and comes finished with scalloped and eyelash-trimmed edges. Cinch your figure with the accompanying waist tie and add in classic pointed pumps.", "418.00", "418.00", "http://click.linksynergy.com/link?id=RIYrAqooNEU&offerid=303076.1007865&type=15&murl=http%3A%2F%2Fwww.matchesfashion.com%2Fproducts%2F1007865%3Fcountry%3DGBR", "Updated"
"425 of 5914 (7.19%)", "11749", "35725_1007865", "linkshare", "Julianna Dress", "Matchesfashion.com - Uk", "http://assetsprx.matchesfashion.com/img/product/500/1007865_1_zoom.jpg", "DVF reworks her iconic wrap dress in occasion-ready floral lace for the new season. In a vivid green hue it has delicate sheer sleeves and comes finished with scalloped and eyelash-trimmed edges. Cinch your figure with the accompanying waist tie and add in classic pointed pumps.", "418.00", "418.00", "http://click.linksynergy.com/link?id=RIYrAqooNEU&offerid=303076.1007865&type=15&murl=http%3A%2F%2Fwww.matchesfashion.com%2Fproducts%2F1007865%3Fcountry%3DGBR", "Updated"
"426 of 5914 (7.20%)", "11748", "35725_1007865", "linkshare", "Julianna Dress", "Matchesfashion.com - Uk", "http://assetsprx.matchesfashion.com/img/product/500/1007865_1_zoom.jpg", "DVF reworks her iconic wrap dress in occasion-ready floral lace for the new season. In a vivid green hue it has delicate sheer sleeves and comes finished with scalloped and eyelash-trimmed edges. Cinch your figure with the accompanying waist tie and add in classic pointed pumps.", "418.00", "418.00", "http://click.linksynergy.com/link?id=RIYrAqooNEU&offerid=303076.1007865&type=15&murl=http%3A%2F%2Fwww.matchesfashion.com%2Fproducts%2F1007865%3Fcountry%3DGBR", "Updated"
"427 of 5914 (7.22%)", "11747", "35725_1006665", "linkshare", "Joyce Floral-print Dress", "Matchesfashion.com - Uk", "http://assetsprx.matchesfashion.com/img/product/500/1006665_1_zoom.jpg", "Spring blooms abound in Erdem\'s Joyce dress. This short-sleeved style has been liberally detailed with graphic florals in tones of yellow and blue: a print that\'s undeniably Erdem. Black accessories work well to complement the chunky zip running along the spine. Think pointed pumps and a box clutch.", "770.00", "770.00", "http://click.linksynergy.com/link?id=RIYrAqooNEU&offerid=303076.1006665&type=15&murl=http%3A%2F%2Fwww.matchesfashion.com%2Fproducts%2F1006665%3Fcountry%3DGBR", "Updated"
"428 of 5914 (7.24%)", "11691", "35653_10834645", "linkshare", "Jenny Packham Sequinned Evening Gown", "Farfetch Uk", "http://cdn-images.farfetch.com/10/83/46/45/10834645_4052255_800.jpg", "Grey sequinned evening gown from Jenny Packham featuring a v-neck, three-quarter length sleeves, a draped design, a rear zip fastening, a long length and Swarovski crystals.", "2924.00", "2924.00", "http://click.linksynergy.com/link?id=RIYrAqooNEU&offerid=183381.10834645&type=15&murl=http%3A%2F%2Fwww.farfetch.com%2Fshopping%2Fwomen%2Fitem10834645.aspx", "Updated"
"429 of 5914 (7.25%)", "11690", "3539_3197394057", "awin", "Jenny Packham Sequin-Embellished Drape Gown - for Women", "Selfridges", "http://images.productserve.com/preview/9/3539/57/40/3197394057.jpg", "Evoke feminine elegance in Jenny Packham ’s fitted embellished gown. Draped at the neckline, the sequin embroidered design features a back central split and sleeveless cut for show stopping appeal.Jenny Packham embellished gownConcealed hook and eye and zip fastening at backV neck, sleeveless, draped neckline, fitted silhouette, all over sequinned embroidered, central split at back, fully lined100% polyesterDry cleanTrue to sizeSize 10: Length 65\"Model is 5ft 10\" and wears a size 10 Size: 12. Color: Bay. Age Group: Adult.. Sequin-embellished drape gown", "2520.00", "0.00", "http://www.awin1.com/pclick.php?p=3197394057&a=99908&m=3539", "Updated"
"430 of 5914 (7.27%)", "11689", "35653_10719382", "linkshare", "Jenny Packham Sequin Embellished Gown", "Farfetch Uk", "http://cdn-images.farfetch.com/10/71/93/82/10719382_3602573_800.jpg", "Black sequin embellished gown from Jenny Packham featuring a round neck, short sleeves, a back zip fastening, a fitted waist and a straight skirt.", "1746.00", "1746.00", "http://click.linksynergy.com/link?id=RIYrAqooNEU&offerid=183381.10719382&type=15&murl=http%3A%2F%2Fwww.farfetch.com%2Fshopping%2Fwomen%2Fitem10719382.aspx", "Updated"
"431 of 5914 (7.29%)", "11688", "35653_10794753", "linkshare", "Jenny Packham Pleated Bodice Belted Long Dress", "Farfetch Uk", "http://cdn-images.farfetch.com/10/79/47/53/10794753_3858829_800.jpg", "Grey silk pleated bodice belted long dress from Jenny Packham.", "2634.00", "2634.00", "http://click.linksynergy.com/link?id=RIYrAqooNEU&offerid=183381.10794753&type=15&murl=http%3A%2F%2Fwww.farfetch.com%2Fshopping%2Fwomen%2Fitem10794753.aspx", "Updated"
"432 of 5914 (7.30%)", "11687", "3194388481", "awin", "Jenny Packham Jewel-embellished Silk Grecian Gown - For Women", "", "", "", "", "", "", "Not Found"
"433 of 5914 (7.32%)", "11686", "35563_220544", "linkshare", "Embellished Evening Gown", "Stylebop.com (uk)", "http://www.stylebop.com/grafic/product2/220/900/220544.jpg", "A real showstopper, Zuhair Murads silk-blend evening gown is fitted with a small waist and a full skirt - a silhouette that promises real impact. Sheer inserts show a hint of skin, while intricate sequin and bead embellishment adds sparkle and shimmer - Black silk blend, round neckline, V-back with zipper, sheer inserts, tulle overlay - Fitted waist, full skirt - Add heels and statement earrings", "5135.00", "5135.00", "http://click.linksynergy.com/link?id=RIYrAqooNEU&offerid=277047.220544&type=15&murl=http%3A%2F%2Fwww.stylebop.com%2Fproduct_details.php%3Fid%3D594145%26partner%3DlinkshareUK", "Updated"
"434 of 5914 (7.34%)", "11685", "35563_220544", "linkshare", "Embellished Evening Gown", "Stylebop.com (uk)", "http://www.stylebop.com/grafic/product2/220/900/220544.jpg", "A real showstopper, Zuhair Murads silk-blend evening gown is fitted with a small waist and a full skirt - a silhouette that promises real impact. Sheer inserts show a hint of skin, while intricate sequin and bead embellishment adds sparkle and shimmer - Black silk blend, round neckline, V-back with zipper, sheer inserts, tulle overlay - Fitted waist, full skirt - Add heels and statement earrings", "5135.00", "5135.00", "http://click.linksynergy.com/link?id=RIYrAqooNEU&offerid=277047.220544&type=15&murl=http%3A%2F%2Fwww.stylebop.com%2Fproduct_details.php%3Fid%3D594145%26partner%3DlinkshareUK", "Updated"
"435 of 5914 (7.36%)", "11684", "35563_215854", "linkshare", "Beaded Silk Cocktail Dress", "Stylebop.com (uk)", "http://www.stylebop.com/grafic/product2/215/900/215854.jpg", "Inspired by the luxe side of the sixties, this bead-embellished cocktail frock from Jenny Packham boasts look-at-me style - Bateau neckline, long bell sleeves, A-line silhouette, allover embellishment, back tie detail - Pair with platform pumps and a classic clutch", "2225.00", "2225.00", "http://click.linksynergy.com/link?id=RIYrAqooNEU&offerid=277047.215854&type=15&murl=http%3A%2F%2Fwww.stylebop.com%2Fproduct_details.php%3Fid%3D562969%26partner%3DlinkshareUK", "Updated"
"436 of 5914 (7.37%)", "11683", "5672_3232443089", "awin", "White Lace Trim Maxi Dress", "Next (UK)", "http://images.productserve.com/preview/2/5672/89/30/3232443089.jpg", "White Lace Trim Maxi Dress", "38.00", "0.00", "http://www.awin1.com/pclick.php?p=3232443089&a=99908&m=5672", "Updated"
"437 of 5914 (7.39%)", "11682", "5672_3232438897", "awin", "White Square Textured Dress", "Next (UK)", "http://images.productserve.com/preview/2/5672/97/88/3232438897.jpg", "White Square Textured Dress", "45.00", "0.00", "http://www.awin1.com/pclick.php?p=3232438897&a=99908&m=5672", "Updated"
"438 of 5914 (7.41%)", "11681", "5672_3200444649", "awin", "White Broderie Dress", "Next (UK)", "http://images.productserve.com/preview/2/5672/49/46/3200444649.jpg", "White Broderie Dress", "38.00", "0.00", "http://www.awin1.com/pclick.php?p=3200444649&a=99908&m=5672", "Updated"
"439 of 5914 (7.42%)", "11680", "5672_3285774227", "awin", "Sheer V-Back Dress", "Next (UK)", "http://images.productserve.com/preview/2/5672/27/42/3285774227.jpg", "Sheer V-Back Dress", "65.00", "0.00", "http://www.awin1.com/pclick.php?p=3285774227&a=99908&m=5672", "Updated"
"440 of 5914 (7.44%)", "11679", "5672_3285774521", "awin", "Panelled Sheer Ecru Dress", "Next (UK)", "http://images.productserve.com/preview/2/5672/21/45/3285774521.jpg", "Panelled Sheer Ecru Dress", "90.00", "0.00", "http://www.awin1.com/pclick.php?p=3285774521&a=99908&m=5672", "Updated"
"441 of 5914 (7.46%)", "11678", "5672_3232444587", "awin", "Navy Maxi Dress With Embellished Neckline", "Next (UK)", "http://images.productserve.com/preview/2/5672/87/45/3232444587.jpg", "Navy Maxi Dress With Embellished Neckline", "50.00", "0.00", "http://www.awin1.com/pclick.php?p=3232444587&a=99908&m=5672", "Updated"
"442 of 5914 (7.47%)", "11677", "5672_3190469519", "awin", "Navy Embellished Maxi Dress", "Next (UK)", "http://images.productserve.com/preview/2/5672/19/95/3190469519.jpg", "Navy Embellished Maxi Dress", "58.00", "0.00", "http://www.awin1.com/pclick.php?p=3190469519&a=99908&m=5672", "Updated"
"443 of 5914 (7.49%)", "11676", "5672_3190469831", "awin", "Navy Belted Dress", "Next (UK)", "http://images.productserve.com/preview/2/5672/31/98/3190469831.jpg", "Navy Belted Dress", "45.00", "0.00", "http://www.awin1.com/pclick.php?p=3190469831&a=99908&m=5672", "Updated"
"444 of 5914 (7.51%)", "11675", "5672_3285775145", "awin", "Hand Beaded Dress", "Next (UK)", "http://images.productserve.com/preview/2/5672/45/51/3285775145.jpg", "Hand Beaded Dress", "175.00", "0.00", "http://www.awin1.com/pclick.php?p=3285775145&a=99908&m=5672", "Updated"
"445 of 5914 (7.52%)", "11674", "3662_3297243643", "awin", "Salia Shirt", "Tommy Hilfiger UK", "http://images.productserve.com/preview/2/3662/43/36/3297243643.jpg", "Striped shirt crafted from lightweight cotton with a linen stripe. Contrast lining and tape inside the small collar, full placket, rounded hem. Roll-tab sleeves in a 3/4 length. Regular, slightly waisted fit. Tommy Hilfiger logo tag on the sleeve.  Our model is 1.76m tall and is wearing a size S Tommy Hilfiger shirt.", "110.00", "110.00", "http://www.awin1.com/pclick.php?p=3297243643&a=99908&m=3662", "Updated"
"446 of 5914 (7.54%)", "11673", "1203_3207930747", "awin", "Jaeger Linen Pintuck Shirt", "John Lewis", "http://images.productserve.com/preview/3/1203/47/07/3207930747.jpg", "Chic, versatile and easy to wear, this feminine linen blouse from Jaeger is a style-staple. Crafted from a lightweight pure linen and cut to a flattering relaxed tunic style fit, this blouse boasts pretty pintuck pleating, a V-neckline with a button-through front and three-quarter length sleeves. Style yours with slim-leg trousers and flats for an effortless daywear option ideal for casual weekends.", "74.25", "74.25", "http://www.awin1.com/pclick.php?p=3207930747&a=99908&m=1203", "Updated"
"447 of 5914 (7.56%)", "11672", "3100_3232405101", "awin", "Jaeger Linen Casual Shirt, Blue", "House of Fraser", "http://images.productserve.com/preview/0/3100/01/51/3232405101.jpg", "Simple and classic, our casual shirt is made from breathable linen   making it ideal for warmer weather. Wear it at the weekend with skinny jeans and flats. Plain, 100% Linen / Flax, Machine Wash 30°C.", "99.00", "0.00", "http://www.awin1.com/pclick.php?p=3232405101&a=99908&m=3100", "Updated"
"448 of 5914 (7.58%)", "11671", "1203_3224658035", "awin", "Jaeger Casual Linen Shirt", "John Lewis", "http://images.productserve.com/preview/3/1203/35/80/3224658035.jpg", "Update your luxe separates with this Casual Linen Shirt from Jaeger. A casual shirt crafted from 100% pure linen, featuring a simple and classic design and a crisp collar. Team with skinny jeans and flats for an elegant off-duty look. Centre Back Length 64cm", "74.25", "74.25", "http://www.awin1.com/pclick.php?p=3224658035&a=99908&m=1203", "Updated"
"449 of 5914 (7.59%)", "11670", "1203_3255761939", "awin", "Jaeger Casual Linen Shirt", "John Lewis", "http://images.productserve.com/preview/3/1203/39/19/3255761939.jpg", "Opt for casual yet chic style with this effortless linen shirt from Jaeger. Crafted from a pure, breathable linen and cut to a relaxed fit, this classic shirt boasts long sleeves, a collar and a concealed button placket. Reign in the silhouette with skinny-fit trousers and flats for easy weekend wear.", "74.25", "74.25", "http://www.awin1.com/pclick.php?p=3255761939&a=99908&m=1203", "Updated"
"450 of 5914 (7.61%)", "11669", "1203_3202927511", "awin", "Jaeger Casual Linen Shirt", "John Lewis", "http://images.productserve.com/preview/3/1203/11/75/3202927511.jpg", "Opt for casual yet chic style with this effortless linen shirt from Jaeger. Crafted from a pure, breathable linen and cut to a relaxed fit, this classic shirt boasts long sleeves, a collar and a concealed button placket. Reign in the silhouette with skinny-fit trousers and flats for easy weekend wear.", "74.25", "74.25", "http://www.awin1.com/pclick.php?p=3202927511&a=99908&m=1203", "Updated"
"451 of 5914 (7.63%)", "11668", "1203_3200353699", "awin", "Jaeger Casual Linen Shirt", "John Lewis", "http://images.productserve.com/preview/3/1203/99/36/3200353699.jpg", "Update your luxe separates with this Casual Linen Shirt from Jaeger. A casual shirt crafted from 100% pure linen, featuring a simple and classic design and a crisp collar. Team with skinny jeans and flats for an elegant off-duty look. Centre Back Length 64cm", "74.25", "74.25", "http://www.awin1.com/pclick.php?p=3200353699&a=99908&m=1203", "Updated"
"452 of 5914 (7.64%)", "11667", "36731_10012665", "linkshare", "0039 Italy Blue Spot Coralie Blouse", "Question-air", "http://www.question-air.com/media/catalog/product/0/0/0039-italy-blue-spot-coralie-blouse-lw0itps50005mul-1.229.jpg", "0039 Italy Blue Spot Coralie Blouse", "109.00", "109.00", "http://click.linksynergy.com/link?id=RIYrAqooNEU&offerid=223253.10012665&type=15&murl=http%3A%2F%2Fwww.question-air.com%2Fcatalog%2Fproduct%2Fview%2Fid%2F12665%2Fs%2F0039-italy-blue-spot-coralie-blouse%2F%3Ffee%3D17%26fep%3D12665", "Updated"
"453 of 5914 (7.66%)", "11666", "2805_3193975159", "awin", "Sicily Cover Up", "Coast", "http://images.productserve.com/preview/5/2805/59/51/3193975159.jpg", "Elevate your separates collection with the beautiful Sicily Lace Jacket. Crafted from romantic lace  this cover up evokes a stunning aesthetic with its scalloped neck and hem. Featuring full length sleeves and buttons to the V back  this jacket offers stunning coverage. Wear over a bandeau dress for ultimate glamour this season.", "75.00", "0.00", "http://www.awin1.com/pclick.php?p=3193975159&a=99908&m=2805", "Updated"
"454 of 5914 (7.68%)", "11665", "2805_3290021799", "awin", "Sian Jacket", "Coast", "http://images.productserve.com/preview/5/2805/99/17/3290021799.jpg", "This perfectly tailored jacket is ideal for both day and night. This fitted piece features an open front and has a slim bodice with full length sleeves. Wear yours over a block colour outfit for a dramatic style. A beautiful clean and contemporary design perfect for any occasion  fully lined for effortless wearing.", "79.00", "0.00", "http://www.awin1.com/pclick.php?p=3290021799&a=99908&m=2805", "Updated"
