"Number", "Post ID", "Product ID", "Affiliate", "Product Title", "Brand", "Image URL", "Description", "Price", "RRP", "Link", "Status"
"732 of 5914 (12.38%)", "11387", "1773224", "linkshare", "9ct White Gold 0.50 Carat Diamond Earrings", "", "", "", "", "", "", "Not Found"
"733 of 5914 (12.39%)", "11386", "1717782", "linkshare", "9ct Gold & White Gold Double Circle Stud Earrings", "", "", "", "", "", "", "Not Found"
"734 of 5914 (12.41%)", "11385", "4013689", "linkshare", "18ct White Gold Half Carat Diamond Three Stone Earrings", "", "", "", "", "", "", "Not Found"
"735 of 5914 (12.43%)", "11384", "8022119", "linkshare", "18ct White Gold Certified Tanzanite & Diamond Earrings", "", "", "", "", "", "", "Not Found"
"736 of 5914 (12.45%)", "11383", "2482363", "linkshare", "18ct White Gold 0.33ct Diamond H/i P1 Solitaire Earrings", "", "", "", "", "", "", "Not Found"
"737 of 5914 (12.46%)", "11382", "6335098", "linkshare", "18ct Gold Third Carat Diamond Daisy Cluster Earrings", "", "", "", "", "", "", "Not Found"
"738 of 5914 (12.48%)", "11381", "2358581", "linkshare", "14ct Rose Gold-plated Four Row Crystal Earrings", "", "", "", "", "", "", "Not Found"
"739 of 5914 (12.50%)", "11380", "2358697", "linkshare", "14ct Gold-plated Beaded Chain Tassle Crystal Earrings", "", "", "", "", "", "", "Not Found"
"740 of 5914 (12.51%)", "11379", "9279571", "linkshare", "14ct Gold Twist Lattice Drop Earrings", "", "", "", "", "", "", "Not Found"
"741 of 5914 (12.53%)", "11378", "3094944475", "awin", "Phase Eight Rosa Panelled Dress", "", "", "", "", "", "", "Not Found"
"742 of 5914 (12.55%)", "11377", "3096607579", "awin", "Phase Eight Sicily Spot Dress", "", "", "", "", "", "", "Not Found"
"743 of 5914 (12.56%)", "11376", "2692_3101183569", "awin", "Phase Eight Rhiannon Paisley Dress", "Phase Eight", "http://images.productserve.com/preview/2/2692/69/35/3101183569.jpg", "A fitted cotton stretch dress featuring cap sleeves and a bold illusion paisley print for a flattering fit. Fully lined for ultimate comfort with a centre back zip fastening.", "84.00", "120.00", "http://www.awin1.com/pclick.php?p=3101183569&a=99908&m=2692", "Updated"
"744 of 5914 (12.58%)", "11375", "2692_3095434029", "awin", "Phase Eight Lettie Lace Fit & Flare Dress", "Phase Eight", "http://images.productserve.com/preview/2/2692/29/40/3095434029.jpg", "A corded lace dress with a sweetheart neckline lining and a feminine fit and flare shape. Styled with a tulle skirt underlay for a full skirt and cap sleeves with scalloped cuffs. Finished with a centre back keyhole detail and zip fastening.", "105.00", "150.00", "http://www.awin1.com/pclick.php?p=3095434029&a=99908&m=2692", "Updated"
"745 of 5914 (12.60%)", "11374", "2692_3096072469", "awin", "Phase Eight LeeAnne Dress", "Phase Eight", "http://images.productserve.com/preview/2/2692/69/24/3096072469.jpg", "This fitted slinky jersey dress with a pretty floral print is styled with a cowl neck and pleat detail at the waist.", "69.00", "99.00", "http://www.awin1.com/pclick.php?p=3096072469&a=99908&m=2692", "Updated"
"746 of 5914 (12.61%)", "11373", "2692_3099005887", "awin", "Phase Eight Bridgette Lace Dress", "Phase Eight", "http://images.productserve.com/preview/2/2692/87/58/3099005887.jpg", "A lace dress with sheer 3/4 length lace sleeves and a floral jersey underlay. Styled with flattering gathered detail at the waist and a pretty scalloped hem. Fastens with a side zip.", "39.00", "130.00", "http://www.awin1.com/pclick.php?p=3099005887&a=99908&m=2692", "Updated"
"747 of 5914 (12.63%)", "11372", "3099660983", "awin", "Phase Eight Benita Printed Dress", "", "", "", "", "", "", "Not Found"
"748 of 5914 (12.65%)", "11371", "3094337777", "awin", "Phase Eight Tulip Print Dress", "", "", "", "", "", "", "Not Found"
"749 of 5914 (12.66%)", "11370", "2692_3094732131", "awin", "Phase Eight Olivia Stripe Dress", "Phase Eight", "http://images.productserve.com/preview/2/2692/31/21/3094732131.jpg", "A striped jersey dress with a cowl neckline and side waist tie for a flattering feminine fit.", "55.00", "79.00", "http://www.awin1.com/pclick.php?p=3094732131&a=99908&m=2692", "Updated"
"750 of 5914 (12.68%)", "11369", "2692_3092296935", "awin", "Phase Eight Mara Floral Printed Shift Dress", "Phase Eight", "http://images.productserve.com/preview/2/2692/35/69/3092296935.jpg", "A cotton shift dress with a colourful floral print. This sleeveless summer dress fits to the figure beautifully with flattering gathered detail on the side panels. Fastens with a zip at the back.", "69.00", "99.00", "http://www.awin1.com/pclick.php?p=3092296935&a=99908&m=2692", "Updated"
"751 of 5914 (12.70%)", "11368", "2692_3090755515", "awin", "Phase Eight Mabel Dress", "Phase Eight", "http://images.productserve.com/preview/2/2692/15/55/3090755515.jpg", "A fitted floral print dress in a slinky jersey with ruching at the neckline and shoulders. Fully lined for ultimate comfort this dress features pleat detail at the waist to provide a flattering fit. Fastens with a centre back zip.", "69.00", "99.00", "http://www.awin1.com/pclick.php?p=3090755515&a=99908&m=2692", "Updated"
"752 of 5914 (12.72%)", "11367", "2692_3090755495", "awin", "Phase Eight Kimono Bird Dress", "Phase Eight", "http://images.productserve.com/preview/2/2692/95/54/3090755495.jpg", "A sleeveless slinky jersey dress with an oriental inspired bird print. Styled with a flattering cowl neck and pleat detail at the waist.", "69.00", "99.00", "http://www.awin1.com/pclick.php?p=3090755495&a=99908&m=2692", "Updated"
"753 of 5914 (12.73%)", "11366", "2692_3093203805", "awin", "Phase Eight Isadora Bridal Dress", "Phase Eight", "http://images.productserve.com/preview/2/2692/05/38/3093203805.jpg", "The epitome of romance this short floral embroidered organza wedding dress has a flattering sweetheart neckline and a pretty scalloped hem. A tulle underlay creates a full skirt while a detachable organza waist tie featuring a pretty oversized back bow cinches in the waist to create a feminine fifties inspired fit and flare silhouette. Closes with a concealed side zip.", "175.00", "350.00", "http://www.awin1.com/pclick.php?p=3093203805&a=99908&m=2692", "Updated"
"754 of 5914 (12.75%)", "11365", "2692_3093787647", "awin", "Phase Eight Ida Rose Dress", "Phase Eight", "http://images.productserve.com/preview/2/2692/47/76/3093787647.jpg", "This feminine rose print dress in a stretch cotton skims the figure for a flattering fit. Styled with a back split and centre back zip.", "89.00", "120.00", "http://www.awin1.com/pclick.php?p=3093787647&a=99908&m=2692", "Updated"
"755 of 5914 (12.77%)", "11364", "2692_3087083087", "awin", "Phase Eight Sassy Spot Dress", "Phase Eight", "http://images.productserve.com/preview/2/2692/87/30/3087083087.jpg", "This fitted slinky jersey dress with a spot print is styled with a cowl neck and pleat detail at the waist.", "69.00", "99.00", "http://www.awin1.com/pclick.php?p=3087083087&a=99908&m=2692", "Updated"
"756 of 5914 (12.78%)", "11363", "39380_6117929", "linkshare", "9ct Gold Sapphire Cubic Zirconia Stud Earrings", "H Samuel", "http://s7ondemand4.scene7.com/is/image/Signet/6117929?$detail745$", "A stylish, classic pair of 9ct gold earrings set with a sapphire surrounded by a cluster of cubic zirconia.", "59.00", "59.00", "http://click.linksynergy.com/link?id=RIYrAqooNEU&offerid=362363.6117929&type=15&murl=http%3A%2F%2Fwww.hsamuel.co.uk%2Fwebstore%2Fd%2F6117929%2F9ct%2Bgold%2Bsapphire%2Bcubic%2Bzirconia%2Bstud%2Bearrings%2F", "Updated"
"757 of 5914 (12.80%)", "11362", "39380_4668626", "linkshare", "9ct Gold Oval Crystal Drop Earrings", "H Samuel", "http://s7ondemand4.scene7.com/is/image/Signet/4668626?$detail745$", "Stunning oval drop earrings in 9ct gold, finished with sparkling crystal teardrop design. These beautiful accessories will add glamour to every outfit.", "39.00", "39.00", "http://click.linksynergy.com/link?id=RIYrAqooNEU&offerid=362363.4668626&type=15&murl=http%3A%2F%2Fwww.hsamuel.co.uk%2Fwebstore%2Fd%2F4668626%2F9ct%2Bgold%2Boval%2Bcrystal%2Bdrop%2Bearrings%2F", "Updated"
"758 of 5914 (12.82%)", "11361", "39380_6669530", "linkshare", "9ct Gold Diamond And Sapphire Three Stone Stud Earrings", "H Samuel", "http://s7ondemand4.scene7.com/is/image/Signet/6669530?$detail745$", "Set with three sumptuous sapphires accented by sparkling diamonds, these elegant 9ct gold earrings are styled in a chic twist. The perfect gift if her birthday\'s in September, as sapphire is her birthstone.", "399.00", "399.00", "http://click.linksynergy.com/link?id=RIYrAqooNEU&offerid=362363.6669530&type=15&murl=http%3A%2F%2Fwww.hsamuel.co.uk%2Fwebstore%2Fd%2F6669530%2F9ct%2Bgold%2Bdiamond%2Band%2Bsapphire%2Bthree%2Bstone%2Bstud%2Bearrings%2F", "Updated"
"759 of 5914 (12.83%)", "11360", "39380_3200558", "linkshare", "9ct Gold Cultured Freshwater Pearl Stud Earrings", "H Samuel", "http://s7ondemand4.scene7.com/is/image/Signet/3200558?$detail745$", "Pearls are a timeless classic. These 9ct gold stud earrings are set with a shimmering cultured freshwater pearl and have a diameter of 5mm. They would complement a wedding dress perfectly or add elegance to a little black dress. Pearl size 5mm.", "24.00", "24.00", "http://click.linksynergy.com/link?id=RIYrAqooNEU&offerid=362363.3200558&type=15&murl=http%3A%2F%2Fwww.hsamuel.co.uk%2Fwebstore%2Fd%2F3200558%2F9ct%2Bgold%2Bcultured%2Bfreshwater%2Bpearl%2Bstud%2Bearrings%2F", "Updated"
"760 of 5914 (12.85%)", "11359", "39380_3200558", "linkshare", "9ct Gold Cultured Freshwater Pearl Stud Earrings", "H Samuel", "http://s7ondemand4.scene7.com/is/image/Signet/3200558?$detail745$", "Pearls are a timeless classic. These 9ct gold stud earrings are set with a shimmering cultured freshwater pearl and have a diameter of 5mm. They would complement a wedding dress perfectly or add elegance to a little black dress. Pearl size 5mm.", "24.00", "24.00", "http://click.linksynergy.com/link?id=RIYrAqooNEU&offerid=362363.3200558&type=15&murl=http%3A%2F%2Fwww.hsamuel.co.uk%2Fwebstore%2Fd%2F3200558%2F9ct%2Bgold%2Bcultured%2Bfreshwater%2Bpearl%2Bstud%2Bearrings%2F", "Updated"
"761 of 5914 (12.87%)", "11358", "39380_1999494", "linkshare", "9ct Gold Cultured Freshwater Pearl Drop Earrings", "H Samuel", "http://s7ondemand4.scene7.com/is/image/Signet/1999494?$detail745$", "Irresistibly elegant, these classic cultured freshwater pearl drop earrings are crafted with a 9ct gold setting. Perfect for every occasion.", "49.00", "49.00", "http://click.linksynergy.com/link?id=RIYrAqooNEU&offerid=362363.1999494&type=15&murl=http%3A%2F%2Fwww.hsamuel.co.uk%2Fwebstore%2Fd%2F1999494%2F9ct%2Bgold%2Bcultured%2Bfreshwater%2Bpearl%2Bdrop%2Bearrings%2F", "Updated"
"762 of 5914 (12.88%)", "11357", "39380_1999494", "linkshare", "9ct Gold Cultured Freshwater Pearl Drop Earrings", "H Samuel", "http://s7ondemand4.scene7.com/is/image/Signet/1999494?$detail745$", "Irresistibly elegant, these classic cultured freshwater pearl drop earrings are crafted with a 9ct gold setting. Perfect for every occasion.", "49.00", "49.00", "http://click.linksynergy.com/link?id=RIYrAqooNEU&offerid=362363.1999494&type=15&murl=http%3A%2F%2Fwww.hsamuel.co.uk%2Fwebstore%2Fd%2F1999494%2F9ct%2Bgold%2Bcultured%2Bfreshwater%2Bpearl%2Bdrop%2Bearrings%2F", "Updated"
"763 of 5914 (12.90%)", "11356", "39380_3548848", "linkshare", "9ct Gold Cubic Zirconia Round Claw Set Stud Earrings", "H Samuel", "http://s7ondemand4.scene7.com/is/image/Signet/3548848?$detail745$", "These round claw set cubic zirconia earrings bring elegance and added sparkle to every outfit, day and night. Set in 9ct gold, size 6mm.", "27.00", "27.00", "http://click.linksynergy.com/link?id=RIYrAqooNEU&offerid=362363.3548848&type=15&murl=http%3A%2F%2Fwww.hsamuel.co.uk%2Fwebstore%2Fd%2F3548848%2F9ct%2Bgold%2Bcubic%2Bzirconia%2Bround%2Bclaw%2Bset%2Bstud%2Bearrings%2F", "Updated"
"764 of 5914 (12.92%)", "11355", "39380_3185907", "linkshare", "9ct Gold Cubic Zirconia Figure Of 8 Drop Earrings", "H Samuel", "http://s7ondemand4.scene7.com/is/image/Signet/3185907?$detail745$", "These stylish drop earrings feature a glittering cubic zirconia, nestled in a twisted band of 9ct gold. Simple elegance for all occasions.", "49.00", "49.00", "http://click.linksynergy.com/link?id=RIYrAqooNEU&offerid=362363.3185907&type=15&murl=http%3A%2F%2Fwww.hsamuel.co.uk%2Fwebstore%2Fd%2F3185907%2F9ct%2Bgold%2Bcubic%2Bzirconia%2Bfigure%2Bof%2B8%2Bdrop%2Bearrings%2F", "Updated"
"765 of 5914 (12.94%)", "11354", "39380_6304710", "linkshare", "9ct Gold Crystal Square Stud Earrings", "H Samuel", "http://s7ondemand4.scene7.com/is/image/Signet/6304710?$detail745$", "A stylish pair of 9ct gold square stud earrings with sparkling crystals. Perfect for those special occasions or to bring a touch of glamour to your everyday look.", "32.00", "32.00", "http://click.linksynergy.com/link?id=RIYrAqooNEU&offerid=362363.6304710&type=15&murl=http%3A%2F%2Fwww.hsamuel.co.uk%2Fwebstore%2Fd%2F6304710%2F9ct%2Bgold%2Bcrystal%2Bsquare%2Bstud%2Bearrings%2F", "Updated"
"766 of 5914 (12.95%)", "11353", "39380_4322207", "linkshare", "9ct Gold Creole Earrings In Presentation Box", "H Samuel", "http://s7ondemand4.scene7.com/is/image/Signet/4322207?$detail745$", "Creole earrings will always be a favourite and this pair features pretty detailing around the hoop.", "69.00", "69.00", "http://click.linksynergy.com/link?id=RIYrAqooNEU&offerid=362363.4322207&type=15&murl=http%3A%2F%2Fwww.hsamuel.co.uk%2Fwebstore%2Fd%2F4322207%2F9ct%2Bgold%2Bcreole%2Bearrings%2Bin%2Bpresentation%2Bbox%2F", "Updated"
"767 of 5914 (12.97%)", "11352", "39380_1357670", "linkshare", "9ct Gold Celtic Stud Earrings", "H Samuel", "http://s7ondemand4.scene7.com/is/image/Signet/1357670?$detail745$", "A beautifully crafted pair of 9ct gold Celtic stud earrings. Perfect for an elegant, classic look.", "29.00", "29.00", "http://click.linksynergy.com/link?id=RIYrAqooNEU&offerid=362363.1357670&type=15&murl=http%3A%2F%2Fwww.hsamuel.co.uk%2Fwebstore%2Fd%2F1357670%2F9ct%2Bgold%2Bceltic%2Bstud%2Bearrings%2F", "Updated"
"768 of 5914 (12.99%)", "11351", "39380_1961861", "linkshare", "9ct Gold Beaded Oval Creole Earrings", "H Samuel", "http://s7ondemand4.scene7.com/is/image/Signet/1961861?$detail745$", "A simply stylish pair of 9ct gold oval creole earrings, crafted with an attractive beaded design. Perfect for effortless, everyday accessorising.", "29.00", "29.00", "http://click.linksynergy.com/link?id=RIYrAqooNEU&offerid=362363.1961861&type=15&murl=http%3A%2F%2Fwww.hsamuel.co.uk%2Fwebstore%2Fd%2F1961861%2F9ct%2Bgold%2Bbeaded%2Boval%2Bcreole%2Bearrings%2F", "Updated"
"769 of 5914 (13.00%)", "11350", "35725_1008374", "linkshare", "Antigona Mini Rubberised Tote", "Matchesfashion.com - Uk", "http://assetsprx.matchesfashion.com/img/product/500/1008374_1_zoom.jpg", "Givenchy\'s black rubberised Antigona tote is the perfect finishing touch to a sports-luxe look. It\'s crafted to the label\'s signature trapeze shape spliced with patent-leather side panels and finished with a slick of pale-gold tone hardware. Carry it by the rolled top handles swing it over one arm or wear it cross-body with the optional long strap.", "1125.00", "1125.00", "http://click.linksynergy.com/link?id=RIYrAqooNEU&offerid=303076.1008374&type=15&murl=http%3A%2F%2Fwww.matchesfashion.com%2Fproducts%2F1008374%3Fcountry%3DGBR", "Updated"
"770 of 5914 (13.02%)", "11349", "39380_1750933", "linkshare", "9ct Gold 26mm Medium Gauge Hoop Earrings", "H Samuel", "http://s7ondemand4.scene7.com/is/image/Signet/1750933?$detail745$", "A simply stylish pair of 26mm medium gauge hoop earrings, crafted in 9ct gold for a classically elegant feel. Perfect for everyday wear.", "69.00", "69.00", "http://click.linksynergy.com/link?id=RIYrAqooNEU&offerid=362363.1750933&type=15&murl=http%3A%2F%2Fwww.hsamuel.co.uk%2Fwebstore%2Fd%2F1750933%2F9ct%2Bgold%2B26mm%2Bmedium%2Bgauge%2Bhoop%2Bearrings%2F", "Updated"
"771 of 5914 (13.04%)", "11348", "39380_1664573", "linkshare", "9ct Gold 10 Point Diamond Wave Stud Earrings", "H Samuel", "http://s7ondemand4.scene7.com/is/image/Signet/1664573?$detail745$", "An elegantly styled pair of 9ct gold stud earrings, set with subtly sparkling diamonds for a touch of glamour and indulgence. Perfect for every occasion.", "199.00", "199.00", "http://click.linksynergy.com/link?id=RIYrAqooNEU&offerid=362363.1664573&type=15&murl=http%3A%2F%2Fwww.hsamuel.co.uk%2Fwebstore%2Fd%2F1664573%2F9ct%2Bgold%2B10%2Bpoint%2Bdiamond%2Bwave%2Bstud%2Bearrings%2F", "Updated"
"772 of 5914 (13.05%)", "11347", "39380_9921400", "linkshare", "9ct Gold 1/10 Carat Diamond Stud Earrings", "H Samuel", "http://s7ondemand4.scene7.com/is/image/Signet/9921400?$detail745$", "A stunning set of carefully crafted 9ct yellow gold stud earrings, set with two sparkling diamonds totalling 10 points. Subtle and classic elegance for all occasions.", "229.00", "229.00", "http://click.linksynergy.com/link?id=RIYrAqooNEU&offerid=362363.9921400&type=15&murl=http%3A%2F%2Fwww.hsamuel.co.uk%2Fwebstore%2Fd%2F9921400%2F9ct%2Bgold%2B1%252F10%2Bcarat%2Bdiamond%2Bstud%2Bearrings%2F", "Updated"
"773 of 5914 (13.07%)", "11346", "39380_1029428", "linkshare", "Together Bonded Silver & 9ct Gold Bangle", "H Samuel", "http://s7ondemand4.scene7.com/is/image/Signet/1029428?$detail745$", "Achieve classic simplicity with this wide polished bangle from Together. Made from a precious combination of bonded silver and 9ct yellow gold, this bangle lends a unique twist to classic gold wristwear.", "198.00", "198.00", "http://click.linksynergy.com/link?id=RIYrAqooNEU&offerid=362363.1029428&type=15&murl=http%3A%2F%2Fwww.hsamuel.co.uk%2Fwebstore%2Fd%2F1029428%2Ftogether%2Bbonded%2Bsilver%2B%2526%2B9ct%2Bgold%2Bbangle%2F", "Updated"
"774 of 5914 (13.09%)", "11345", "39380_8406073", "linkshare", "9ct Cultured Freshwater Pearl Earrings 7mm", "H Samuel", "http://s7ondemand4.scene7.com/is/image/Signet/8406073?$detail745$", "A classic pair of freshwater pearl stud earrings crafted in 9ct white gold. An elegant gift for an elegant woman. Pearl size 7-7.5mm.", "34.00", "34.00", "http://click.linksynergy.com/link?id=RIYrAqooNEU&offerid=362363.8406073&type=15&murl=http%3A%2F%2Fwww.hsamuel.co.uk%2Fwebstore%2Fd%2F8406073%2F9ct%2Bcultured%2Bfreshwater%2Bpearl%2Bearrings%2B7mm%2F", "Updated"
"775 of 5914 (13.10%)", "11344", "39380_6467547", "linkshare", "9ct 3 Colour Gold Cubic Zirconia Knot Stud Earrings", "H Samuel", "http://s7ondemand4.scene7.com/is/image/Signet/6467547?$detail745$", "Featuring 9ct yellow, white and rose gold, these pretty stud earrings with sparkling cubic zirconia will look great with any outfit. Perfect for everyday elegance.", "49.00", "49.00", "http://click.linksynergy.com/link?id=RIYrAqooNEU&offerid=362363.6467547&type=15&murl=http%3A%2F%2Fwww.hsamuel.co.uk%2Fwebstore%2Fd%2F6467547%2F9ct%2B3%2Bcolour%2Bgold%2Bcubic%2Bzirconia%2Bknot%2Bstud%2Bearrings%2F", "Updated"
"776 of 5914 (13.12%)", "11343", "39380_9628215", "linkshare", "9 Carat Yellow Gold Stone Set Heart Drop Earrings", "H Samuel", "http://s7ondemand4.scene7.com/is/image/Signet/9628215?$detail745$", "Gorgeous silver coloured crystal embellished heart drops set on 9 carat yellow gold earrings. A sparkling, feminine accessory ideal for party wear, or as a glamorous gift.", "39.00", "39.00", "http://click.linksynergy.com/link?id=RIYrAqooNEU&offerid=362363.9628215&type=15&murl=http%3A%2F%2Fwww.hsamuel.co.uk%2Fwebstore%2Fd%2F9628215%2F9%2Bcarat%2Byellow%2Bgold%2Bstone%2Bset%2Bheart%2Bdrop%2Bearrings%2F", "Updated"
"777 of 5914 (13.14%)", "11342", "39380_9628231", "linkshare", "9 Carat Yellow Gold Crystal Drop Earrings", "H Samuel", "http://s7ondemand4.scene7.com/is/image/Signet/9628231?$detail745$", "A lavish pair of crystal embellished drop earrings bonded with gleaming 9 carat yellow gold. Glamorous jewellery perfect for that compulsory bit of sparkle during the festive season. Wear alone with a little black dress for a striking shot of sophisticated glamour.", "69.00", "69.00", "http://click.linksynergy.com/link?id=RIYrAqooNEU&offerid=362363.9628231&type=15&murl=http%3A%2F%2Fwww.hsamuel.co.uk%2Fwebstore%2Fd%2F9628231%2F9%2Bcarat%2Byellow%2Bgold%2Bcrystal%2Bdrop%2Bearrings%2F", "Updated"
"778 of 5914 (13.16%)", "11341", "39380_6715036", "linkshare", "8mm Glitter Stud Earrings", "H Samuel", "http://s7ondemand4.scene7.com/is/image/Signet/6715036?$detail745$", "A stunning pair of Evoke glitter stud earrings. Perfect for a big night out, or to bring a little extra dazzle to your look. 8mm", "29.00", "29.00", "http://click.linksynergy.com/link?id=RIYrAqooNEU&offerid=362363.6715036&type=15&murl=http%3A%2F%2Fwww.hsamuel.co.uk%2Fwebstore%2Fd%2F6715036%2F8mm%2Bglitter%2Bstud%2Bearrings%2F", "Updated"
"779 of 5914 (13.17%)", "11340", "39380_2368935", "linkshare", "14ct Vanilla Gold Ocean Blue Topaz & Diamond Ring", "H Samuel", "http://s7ondemand4.scene7.com/is/image/Signet/2368935?$detail745$", "Indulge in the elegant beauty of Chocolate by Petite Le Vian. With a vivid rectangular Ocean Blue Topaz at its centre, this stunning ring is crafted from sumptuous 14ct Vanilla Gold and finished with deliciously dazzling Chocolate and Vanilla Diamonds on the shoulders for breathtaking beauty and unique, glamorous style.", "750.00", "750.00", "http://click.linksynergy.com/link?id=RIYrAqooNEU&offerid=362363.2368935&type=15&murl=http%3A%2F%2Fwww.hsamuel.co.uk%2Fwebstore%2Fd%2F2368935%2F14ct%2Bvanilla%2Bgold%2Bocean%2Bblue%2Btopaz%2B%2526%2Bdiamond%2Bring%2F", "Updated"
"780 of 5914 (13.19%)", "11339", "3144945559", "awin", "Panther Drop Earrings", "", "", "", "", "", "", "Not Found"
"781 of 5914 (13.21%)", "11338", "3539_3200580177", "awin", "Mawi Spiked Crystal Firefly Earrings - for Women", "Selfridges", "http://images.productserve.com/preview/9/3539/77/01/3200580177.jpg", "In keeping with Mawi\'s signature organically inspired, elaborately jewelled pieces, these earrings resemble fireflies with ornate glittering crystal wings and tough gunmetal toned spikes. These large, sparkling earrings will steal the show with any ensemble.Mawi spiked crystal earringsPost and clip back for pierced earsCrystals, spikesHematite platedPolish with a soft clothWe regret that for hygiene reasons, earrings cannot be returned unless faulty Color: Silver.. Spiked crystal firefly earrings", "270.00", "0.00", "http://www.awin1.com/pclick.php?p=3200580177&a=99908&m=3539", "Updated"
"782 of 5914 (13.22%)", "11337", "10927259", "linkshare", "Chanel Logo Clip On Earrings", "", "", "", "", "", "", "Not Found"
"783 of 5914 (13.24%)", "11336", "1203_565879541", "awin", "Carolee Rectangular Button Crystal Clip Earrings", "John Lewis", "http://images.productserve.com/preview/3/1203/41/95/565879541.jpg", " Elegant and sophisticated, these rectangular earrings from Carolee are timeless. They instantly add glamour to your ensemble. At the centre is a large rectangular glass stone surrounded by smaller white glass stones, set in imitation rhodium plating. Length x Width: 1.3 x 1cm", "25.00", "25.00", "http://www.awin1.com/pclick.php?p=565879541&a=99908&m=1203", "Updated"
"784 of 5914 (13.26%)", "11335", "1203_616327205", "awin", "Carolee Rectangular Button Crystal Clip Earrings", "John Lewis", "http://images.productserve.com/preview/3/1203/05/72/616327205.jpg", " Elegant and sophisticated, these rectangular earrings from Carolee are timeless. They instantly add glamour to your ensemble. At the centre is a large rectangular glass stone surrounded by smaller white glass stones, set in imitation rhodium plating. Length x Width: 1.3 x 1cm", "25.00", "25.00", "http://www.awin1.com/pclick.php?p=616327205&a=99908&m=1203", "Updated"
"785 of 5914 (13.27%)", "11334", "1203_3125755367", "awin", "Carolee Cushion Crystal Clip-On Earrings, Emerald Green", "John Lewis", "http://images.productserve.com/preview/3/1203/67/53/3125755367.jpg", "Sparkling earrings from Carolee, featuring an imitation emerald in a cushion-cut shape, bordered by glittering round cut crystals. With silver toned clip-on fittings.", "25.00", "25.00", "http://www.awin1.com/pclick.php?p=3125755367&a=99908&m=1203", "Updated"
"786 of 5914 (13.29%)", "11333", "1203_3111129007", "awin", "Carolee Crystal Demi-Hoop Clip-On Earrings, Silver", "John Lewis", "http://images.productserve.com/preview/3/1203/07/90/3111129007.jpg", "Sparkling demi-hoop earrings from Carolee, featuring a row of square cut crystals bracketed by two glittering rows of round-cut stones. With silver toned clip-on fittings.", "42.00", "42.00", "http://www.awin1.com/pclick.php?p=3111129007&a=99908&m=1203", "Updated"
"787 of 5914 (13.31%)", "11332", "10530748", "linkshare", "Chanel Vintage Logo Earrings", "", "", "", "", "", "", "Not Found"
"788 of 5914 (13.32%)", "11331", "35653_10917295", "linkshare", "Chanel Vintage Embellished Dangle Earrings", "Farfetch Uk", "http://cdn-images.farfetch.com/10/91/72/95/10917295_4429158_800.jpg", "Gold-tone embellished dangle earrings from Chanel Vintage featuring a clip on fastening and a back embossed logo stamp. Please note that vintage items are not new and therefore might have minor imperfections.", "589.00", "589.00", "http://click.linksynergy.com/link?id=RIYrAqooNEU&offerid=183381.10917295&type=15&murl=http%3A%2F%2Fwww.farfetch.com%2Fshopping%2Fwomen%2Fitem10917295.aspx", "Updated"
"789 of 5914 (13.34%)", "11330", "35653_10958024", "linkshare", "Chanel Vintage Logo Pendant Earrings", "Farfetch Uk", "http://cdn-images.farfetch.com/10/95/80/24/10958024_4598171_800.jpg", "18kt gold logo pendant earrings from Chanel Vintage featuring a clip on fastening and a back embossed logo stamp. Please note that vintage items are not new and therefore might have minor imperfections. Please note that Farfetch does not accept returns on earrings.", "1088.00", "1088.00", "http://click.linksynergy.com/link?id=RIYrAqooNEU&offerid=183381.10958024&type=15&murl=http%3A%2F%2Fwww.farfetch.com%2Fshopping%2Fwomen%2Fitem10958024.aspx", "Updated"
